<?xml version="1.0" encoding="UTF-8"?>
<Transmission xmlns:xsi="http://www.w3.org/2001/XMLSchema-instance" xsi:noNamespaceSchemaLocation="C:\var\opt\apps\RT\schemas\reservationRS.xsd">
	<Payload>
		<PayloadHeader>
			<PayloadID>99999999999999999999</PayloadID>
			<TSPayloadID> 8888888</TSPayloadID>
			<Target>PROD-WDW</Target>
			<Version>1.0</Version>
			<Comm>
				<Protocol>IP</Protocol>
				<Method>Network</Method>
			</Comm>
			<TransmitDate>2009-01-23</TransmitDate>
			<TransmitTime>11:38:20.123</TransmitTime>
			<TktBroker>DTI01</TktBroker>
			<CommandCount>1</CommandCount>
			<PayloadError>
				<HdrErrorCode>799</HdrErrorCode>
				<HdrErrorType>Critical</HdrErrorType>
				<HdrErrorClass>Servelet</HdrErrorClass>
				<HdrErrorText>Undefined Critical Error</HdrErrorText>
			</PayloadError>
		</PayloadHeader>
		<Command>
			<CommandHeader>
				<CmdItem>1</CmdItem>
				<CmdDuration>0.00</CmdDuration>
				<CmdDate>2009-01-23</CmdDate>
				<CmdTime>11:38:20.456</CmdTime>
				<CmdError>
					<CmdErrorCode>799</CmdErrorCode>
					<CmdErrorType>Critical</CmdErrorType>
					<CmdErrorClass>Servelet</CmdErrorClass>
					<CmdErrorText>Undefined Critical Error</CmdErrorText>
				</CmdError>
			</CommandHeader>
			<ReservationResponse>
				<ResponseType>Create</ResponseType>
				<Ticket>
					<TktItem>1</TktItem>
					<TktID>
						<Barcode>33333333333333333333</Barcode>
						<TktDSSN>
							<TktDate>2008-11-01</TktDate>
							<TktSite>WMK</TktSite>
							<TktStation>111</TktStation>
							<TktNbr>222</TktNbr>
						</TktDSSN>
						<TktNID>44444444444444444</TktNID>
					</TktID>
					<TktPrice>500.05</TktPrice>
					<TktTax>50.05</TktTax>
					<TktValidity>
						<ValidStart>2008-09-20</ValidStart>
						<ValidEnd>2009-09-20</ValidEnd>
					</TktValidity>
					<TktError>
						<TktErrorCode>799</TktErrorCode>
						<TktErrorType>Critical</TktErrorType>
						<TktErrorClass>Servelet</TktErrorClass>
						<TktErrorText>Undefined Critical Error</TktErrorText>
					</TktError>
				</Ticket>
				<Ticket>
					<TktItem>2</TktItem>
					<TktID>
						<Barcode>33333333333333333333</Barcode>
						<TktDSSN>
							<TktDate>2008-11-01</TktDate>
							<TktSite>WMK</TktSite>
							<TktStation>111</TktStation>
							<TktNbr>222</TktNbr>
						</TktDSSN>
						<TktNID>44444444444444444</TktNID>
					</TktID>
					<TktPrice>500.05</TktPrice>
					<TktTax>50.05</TktTax>
					<TktValidity>
						<ValidStart>2008-09-20</ValidStart>
						<ValidEnd>2009-09-20</ValidEnd>
					</TktValidity>
				</Ticket>
				<Payment>
					<PayItem>1</PayItem>
					<PayType>
						<CreditCard>
							<CCAuthCode>0</CCAuthCode>
							<CCAuthNumber>44582B    </CCAuthNumber>
							<CCAuthSysResponse>ICUNUROK</CCAuthSysResponse>
							<CCNumber>4444333322221111</CCNumber>
						</CreditCard>
					</PayType>
				</Payment>
				<Payment>
					<PayItem>2</PayItem>
					<PayType>
						<GiftCard>
							<GCAuthCode>ANAUTHCODE</GCAuthCode>
							<GCAuthNumber>44582B    </GCAuthNumber>
							<GCAuthSysResponse>ICUNUROK</GCAuthSysResponse>
							<GCNumber>1111222233334444</GCNumber>
							<GCRemainingBalance>1.23</GCRemainingBalance>
							<GCPromoExpDate>2009-12-31</GCPromoExpDate>
						</GiftCard>
					</PayType>
				</Payment>
				<Receipt>
					<Message>This is a receipt message.</Message>
				</Receipt>
				<Reservation>
					<ResCode>DOL1234567</ResCode>
				</Reservation>
				<ClientData>
					<ClientId>6292288</ClientId>
				</ClientData>
			</ReservationResponse>
		</Command>
	</Payload>
</Transmission>